{
  "$schema": "https://json-schema.org/draft/2020-12/schema",
  "title": "execution_order",
  "type": "object",
  "properties": {
    "symbol": {
      "type": "string"
    },
    "action": {
      "type": "string"
    },
    "side": {
      "type": "string"
    },
    "confidence": {
      "type": [
        "number",
        "null"
      ]
    },
    "max_position_pct": {
      "type": [
        "number",
        "null"
      ]
    },
    "stop_condition": {
      "type": [
        "string",
        "null"
      ]
    },
    "take_profit_mode": {
      "type": [
        "string",
        "null"
      ]
    },
    "execution_status": {
      "type": "string"
    },
    "updated_at": {
      "type": "string"
    }
  },
  "required": [
    "symbol",
    "action",
    "side",
    "execution_status",
    "updated_at"
  ]
}